,Nom,Activite_principale,Adresse,Ville,Telephone,Detail,Lien_entreprise,Facebook,Linkedin,Autre_lien,Lien_europage
558,VARICOR,Fabricant/Producteur,30 Rue De La Scierie,67130 Wisches,+33 388475520,"L'entreprise VARICOR, est un Fabricant/ Producteur, crée en 1985, qui travaille dans le secteur Céramique - produits pour l'industrie. Elle est également présente dans les secteurs Céramique, porcelaine et faïence - produits pour l'industrie, et Porcelaine - produits pour l'industrie. Elle est basée à Wisches, France.",http://www.varicor.fr,,,,https://www.europages.fr/VARICOR/FRA026245-00101.html
559,CHAMBRE COMMERCE ET INDUSTRIE GRENOBLE,Prestataire de services,1 Place André Malraux,38000 Grenoble,+33 476282800,"L'entreprise CHAMBRE COMMERCE ET INDUSTRIE GRENOBLE, est un Prestataire de services, qui travaille dans le secteur Organismes pour le commerce. Elle est également présente dans les secteurs Chambres de commerce et d'industrie. Elle est basée à Grenoble, France.",https://www.grenoble.cci.fr/,,,,https://www.europages.fr/CHAMBRE-COMMERCE-ET-INDUSTRIE-GRENOBLE/FRA270153-00101.html
560,BMN TRANSPORT-LOGISTIQUE,Prestataire de services,6 boulevard Alexandre de fraissinette ,42100 Saint Etienne,+33 0767590581,"L'entreprise BMN TRANSPORT-LOGISTIQUE, est un Prestataire de services, qui travaille dans le secteur Transport express. Elle est également présente dans les secteurs Transport express pour l'industrie. Elle est basée à Saint Etienne, France.",https://Bmntransport.fr,,,,https://www.europages.fr/BMN-TRANSPORTLOGISTIQUE/00000005486159-001.html
561,RAVMO,Grossiste,11 T RUE BERGERET,95290 L'isle Adam,,"L'entreprise RAVMO, est un Grossiste, qui travaille dans le secteur Outils industriels. Elle est également présente dans les secteurs fourniture pour l'industrie electrotechnique, et fourniture pour industrie aeronautique. Elle est basée à L'isle Adam, France.",,,,,https://www.europages.fr/RAVMO/00000005453373-001.html
562,VERHAEGHE INDUSTRIE,Prestataire de services,Zi Ravennes Les Francs,"L'entreprise VERHAEGHE INDUSTRIE, crée en 1987, qui travaille dans le secteur Nettoyage - services. Elle est basée à Bondues, France.",+33 320271919,"L'entreprise VERHAEGHE INDUSTRIE, crée en 1987, qui travaille dans le secteur Nettoyage - services. Elle est basée à Bondues, France.",http://www.verhaeghe-industries.fr/,,,,https://www.europages.fr/VERHAEGHE-INDUSTRIE/FRA038857-00101.html
563,MD INDUSTRIE,Prestataire de services,62 Rue Volant,92000 Nanterre,,"L'entreprise MD INDUSTRIE, est un Prestataire de services, crée en 1992, qui travaille dans le secteur Ingénierie - ensembliers industriels. Elle est également présente dans les secteurs Bureaux équipés et locaux industriels - services. Elle est basée à Nanterre, France.",,,,,https://www.europages.fr/MD-INDUSTRIE/FRA341926-00101.html
564,OUEST INDUSTRIE,Fabricant/Producteur,,"L'entreprise OUEST INDUSTRIE, crée en 1974, qui travaille dans le secteur Aciers. Elle est basée à Dangers, France.",+33 237229120,"L'entreprise OUEST INDUSTRIE, crée en 1974, qui travaille dans le secteur Aciers. Elle est basée à Dangers, France.",http://www.citeweb.net/oindus,,,,https://www.europages.fr/OUEST-INDUSTRIE/FRA017398-00101.html
565,H.P. AQUARIUM,Fabricant/Producteur,2 Impasse De Rodern,67600 Selestat,+33 388828203,"L'entreprise H.P. AQUARIUM, est un Fabricant/ Producteur, crée en 1998, qui travaille dans le secteur Verre pour l'industrie. Elle est basée à Selestat, France.",http://www.hpaquarium.com/,,,,https://www.europages.fr/HP-AQUARIUM/FRA354312-00101.html
566,SARL EXPLOITATION ATELIERS HERVEDEBITUS,Fabricant/Producteur,24 Rue De La Bourde,37000 Tours,+33 247379980,"L'entreprise SARL EXPLOITATION ATELIERS HERVE  DEBITUS, est un Fabricant/ Producteur, crée en 1996, qui travaille dans le secteur Verre pour l'industrie. Elle est basée à Tours, France.",http://www.debitus.com,,,,https://www.europages.fr/SARL-EXPLOITATION-ATELIERS-HERVE-DEBITUS/FRA349457-00101.html
567,GAZZAVITRAGE,Grossiste,850 Avenue Et Marie Curie,06700 St Laurent Du Var,+33 493071010,"L'entreprise GAZZAVITRAGE, est un Grossiste, crée en 1996, qui travaille dans le secteur Verre pour l'industrie. Elle est basée à St Laurent Du Var, France.",https://www.vitragecotedazur.com/,,,,https://www.europages.fr/GAZZAVITRAGE/FRA098820-00101.html
568,SOTECO INDUSTRIE,Fabricant/Producteur,64 Rue Lafayette,77610 Fontenay Tresigny,+33 164259494,"L'entreprise SOTECO INDUSTRIE, est un Fabricant/ Producteur, crée en 1979, qui travaille dans le secteur Caoutchouc et plastique - transformation. Elle est basée à Fontenay Tresigny, France.",https://www.soteco.fr/,,,,https://www.europages.fr/SOTECO-INDUSTRIE/FRA061030-00101.html
569,FRANSOR INDUSTRIE,Fabricant/Producteur,,"L'entreprise FRANSOR INDUSTRIE, crée en 1992, qui travaille dans le secteur Métaux précieux et spéciaux. Elle est basée à Colombes, France.",+33 142428527,"L'entreprise FRANSOR INDUSTRIE, crée en 1992, qui travaille dans le secteur Métaux précieux et spéciaux. Elle est basée à Colombes, France.",http://www.fransor-industrie.fr,,,,https://www.europages.fr/FRANSOR-INDUSTRIE/FRA163454-00101.html
570,ANCIENS ATELIERS BARTHE BORDEREAU,Fabricant/Producteur,,"L'entreprise ANCIENS ATELIERS BARTHE BORDEREAU, qui travaille dans le secteur Verre pour l'industrie. Elle est également présente dans les secteurs Verre pour l'industrie des moyens de transport. Elle est basée à Angers, France.",,"L'entreprise ANCIENS ATELIERS BARTHE BORDEREAU, qui travaille dans le secteur Verre pour l'industrie. Elle est également présente dans les secteurs Verre pour l'industrie des moyens de transport. Elle est basée à Angers, France.",,,,,https://www.europages.fr/ANCIENS-ATELIERS-BARTHE-BORDEREAU/FRA721789-00101.html
571,SAUMA INDUSTRIE,Fabricant/Producteur,40 Avenue Karl Marx,69120 Vaulx En Velin,+33 478800462,"L'entreprise SAUMA INDUSTRIE, est un Fabricant/ Producteur, crée en 1976, qui travaille dans le secteur Aciers et métaux - usinage. Elle est basée à Vaulx En Velin, France.",http://www.sauma.fr,,,,https://www.europages.fr/SAUMA-INDUSTRIE/FRA079914-00101.html
572,GAGGENAU INDUSTRIE,Fabricant/Producteur,,"L'entreprise GAGGENAU INDUSTRIE, crée en 1929, qui travaille dans le secteur Electroménager - gros appareils. Elle est basée à Lipsheim, France.",+33 388590420,"L'entreprise GAGGENAU INDUSTRIE, crée en 1929, qui travaille dans le secteur Electroménager - gros appareils. Elle est basée à Lipsheim, France.",http://www.gaggenau.com,,,,https://www.europages.fr/GAGGENAU-INDUSTRIE/FRA081337-00101.html
573,MIROITERIE ARDENNAISE,Fabricant/Producteur,,"L'entreprise MIROITERIE ARDENNAISE, qui travaille dans le secteur Verre pour l'industrie. Elle est également présente dans les secteurs Verre pour l'industrie des moyens de transport. Elle est basée à Boulzicourt, France.",,"L'entreprise MIROITERIE ARDENNAISE, qui travaille dans le secteur Verre pour l'industrie. Elle est également présente dans les secteurs Verre pour l'industrie des moyens de transport. Elle est basée à Boulzicourt, France.",,,,,https://www.europages.fr/MIROITERIE-ARDENNAISE/FRA776151-00101.html
574,OPTIK-C,Fabricant/Producteur,Zi Des Vauguillettes,"L'entreprise OPTIK-C, crée en 2002, qui travaille dans le secteur Verre pour l'industrie. Elle est basée à Malay Le Grand, France.",+33 386830048,"L'entreprise OPTIK-C, crée en 2002, qui travaille dans le secteur Verre pour l'industrie. Elle est basée à Malay Le Grand, France.",http://www.optik-c.fr,,,,https://www.europages.fr/OPTIKC/FRA379493-00101.html
575,DELAMARE INDUSTRIE,Fabricant/Producteur,Zone Industrielle,"L'entreprise DELAMARE INDUSTRIE, crée en 1978, qui travaille dans le secteur Aciers et métaux - formage et découpage. Elle est également présente dans les secteurs Chaudronnerie. Elle est basée à St Etienne Du Rouvray, France.",,"L'entreprise DELAMARE INDUSTRIE, crée en 1978, qui travaille dans le secteur Aciers et métaux - formage et découpage. Elle est également présente dans les secteurs Chaudronnerie. Elle est basée à St Etienne Du Rouvray, France.",,,,,https://www.europages.fr/DELAMARE-INDUSTRIE/FRA060783-00101.html
576,SARL ATELIER DE VITRAIL SAINT JOSEPH,Fabricant/Producteur,,"L'entreprise SARL ATELIER DE VITRAIL SAINT JOSEPH, qui travaille dans le secteur Verre pour l'industrie. Elle est basée à Ruffec, France.",+33 545310433,"L'entreprise SARL ATELIER DE VITRAIL SAINT JOSEPH, qui travaille dans le secteur Verre pour l'industrie. Elle est basée à Ruffec, France.",http://www.atelier-vitrail.com/,,,,https://www.europages.fr/SARL-ATELIER-DE-VITRAIL-SAINT-JOSEPH/FRA386630-00101.html
577,ATELIER JEAN PREMONT SARL,Fabricant/Producteur,,"L'entreprise ATELIER JEAN PREMONT SARL, qui travaille dans le secteur Verre pour l'industrie. Elle est basée à Bordeaux, France.",+33 556397000,"L'entreprise ATELIER JEAN PREMONT SARL, qui travaille dans le secteur Verre pour l'industrie. Elle est basée à Bordeaux, France.",https://atelierpremont.wixsite.com/v01/prestations,,,,https://www.europages.fr/ATELIER-JEAN-PREMONT-SARL/FRA783878-00101.html
578,NLH INDUSTRIE,Distributeur,,"L'entreprise NLH INDUSTRIE, qui travaille dans le secteur Location d'équipements industriels. Elle est basée à Jouars Pontchartrain, France.",+33 140838455,"L'entreprise NLH INDUSTRIE, qui travaille dans le secteur Location d'équipements industriels. Elle est basée à Jouars Pontchartrain, France.",http://www.isovent-nlh.com,,,,https://www.europages.fr/NLH-INDUSTRIE/FRA596861-00101.html
579,BOUC BEL AIR VITRERIE,Fabricant/Producteur,,"L'entreprise BOUC BEL AIR VITRERIE, qui travaille dans le secteur Verre pour l'industrie. Elle est également présente dans les secteurs Verre pour l'industrie des moyens de transport. Elle est basée à Bouc Bel Air, France.",,"L'entreprise BOUC BEL AIR VITRERIE, qui travaille dans le secteur Verre pour l'industrie. Elle est également présente dans les secteurs Verre pour l'industrie des moyens de transport. Elle est basée à Bouc Bel Air, France.",,,,,https://www.europages.fr/BOUC-BEL-AIR-VITRERIE/FRA614267-00101.html
580,ADE,Fabricant/Producteur,,"L'entreprise ADE, qui travaille dans le secteur Verre pour l'industrie. Elle est également présente dans les secteurs Verre pour l'industrie des moyens de transport. Elle est basée à Pont Eveque, France.",,"L'entreprise ADE, qui travaille dans le secteur Verre pour l'industrie. Elle est également présente dans les secteurs Verre pour l'industrie des moyens de transport. Elle est basée à Pont Eveque, France.",,,,,https://www.europages.fr/ADE/FRA677349-00101.html
581,HOLOPHANE SA,Fabricant/Producteur,,"L'entreprise HOLOPHANE SA, crée en 1927, qui travaille dans le secteur Verre pour l'industrie. Elle est basée à Les Andélys, France.",+33 232647800,"L'entreprise HOLOPHANE SA, crée en 1927, qui travaille dans le secteur Verre pour l'industrie. Elle est basée à Les Andélys, France.",http://www.holophane.fr,,,,https://www.europages.fr/HOLOPHANE-SA/FRA313764-00101.html
582,FRANCARE INDUSTRIE,Multi-Catégorie,,"L'entreprise FRANCARE INDUSTRIE, crée en 1988, qui travaille dans le secteur Médico-chirurgie - appareils et équipements. Elle est basée à Paris, France.",,"L'entreprise FRANCARE INDUSTRIE, crée en 1988, qui travaille dans le secteur Médico-chirurgie - appareils et équipements. Elle est basée à Paris, France.",http://www.francare.com,,,,https://www.europages.fr/FRANCARE-INDUSTRIE/FRA309664-00101.html
584,VERRE D ART DE LA BRESLE,Fabricant/Producteur,23 Route D'Eu,76340 Blangy Sur Bresle,+33 235935701,"L'entreprise VERRE D ART DE LA BRESLE, est un Fabricant/ Producteur, crée en 1992, qui travaille dans le secteur Verre pour l'industrie. Elle est basée à Blangy Sur Bresle, France.",http://membres.lycos.fr/deirossi/,,,,https://www.europages.fr/VERRE-D-ART-DE-LA-BRESLE/FRA342444-00101.html
585,FRAMIMEX INDUSTRIE,Prestataire de services,39 Boulevard Carnot,60400 Noyon,,"L'entreprise FRAMIMEX INDUSTRIE, est un Prestataire de services, crée en 1980, qui travaille dans le secteur Récupération et recyclage de produits divers. Elle est également présente dans les secteurs Environnement - services. Elle est basée à Noyon, France.",,,,,https://www.europages.fr/FRAMIMEX-INDUSTRIE/FRA328177-00101.html
587,LIONCE INDUSTRIE,Prestataire de services,Chemin De La Petite Charmoie,72440 Bouloire,+33 243631300,"L'entreprise LIONCE INDUSTRIE, est un Prestataire de services, crée en 1993, qui travaille dans le secteur Sérigraphie. Elle est basée à Bouloire, France.",https://www.lionceindustries.com/,,,,https://www.europages.fr/LIONCE-INDUSTRIE/FRA040730-00101.html
588,MARCEL INDUSTRIE,Fabricant/Producteur,Quartier Gervans,26730 La Baume D'Hostun,+33 475484229,"L'entreprise MARCEL INDUSTRIE, est un Fabricant/ Producteur, crée en 1996, qui travaille dans le secteur Aciers et métaux - usinage. Elle est basée à La Baume D'Hostun, France.",http://www.marcel-industrie.com/,,,,https://www.europages.fr/MARCEL-INDUSTRIE/FRA039863-00101.html
589,GCP INDUSTRIE SAS,Fabricant/Producteur,,"L'entreprise GCP INDUSTRIE SAS, crée en 1983, qui travaille dans le secteur Peinture - machines et installations. Elle est basée à Fécamp Cedex, France.",+33 235294080,"L'entreprise GCP INDUSTRIE SAS, crée en 1983, qui travaille dans le secteur Peinture - machines et installations. Elle est basée à Fécamp Cedex, France.",https://www.gcpindustrie.fr/,,,,https://www.europages.fr/GCP-INDUSTRIE-SAS/FRA029620-00101.html
590,MEA INDUSTRIE SARL,Fabricant/Producteur,25 Avenue Le Corbusier,88100 St Die Des Vosges,+33 329516363,"L'entreprise MEA INDUSTRIE SARL, est un Fabricant/ Producteur, crée en 1989, qui travaille dans le secteur Caoutchouc et plastique - transformation. Elle est basée à St Die Des Vosges, France.",http://www.mea-group.com,,,,https://www.europages.fr/MEA-INDUSTRIE-SARL/FRA032738-00101.html
592,CARTONNERIE DE ST JUST MALMONT,Grossiste,La Font Du Loup,43240 St Just Malmont,,"L'entreprise CARTONNERIE DE ST JUST MALMONT, est un Grossiste, crée en 1995, qui travaille dans le secteur Carton - fabrication. Elle est également présente dans les secteurs Carton pour l'industrie de l'emballage. Elle est basée à St Just Malmont, France.",,,,,https://www.europages.fr/CARTONNERIE-DE-ST-JUST-MALMONT/FRA000863-00101.html
593,CTE REGIONAL AQUITAINE CCI,Prestataire de services,52 Cours Gambetta,47000 Agen,+33 553771000,"L'entreprise CTE REGIONAL AQUITAINE CCI, est un Prestataire de services, crée en 1996, qui travaille dans le secteur Chambres de commerce et d'industrie. Elle est basée à Agen, France.",http://www.lot-et-garonne.cci.fr,,,,https://www.europages.fr/CTE-REGIONAL-AQUITAINE-CCI/FRA030860-00101.html
594,SOCIETE INDUSTRIELLE DE MATERIEL DE CONSERVATION SIMACO,Fabricant/Producteur,,"L'entreprise SOCIETE INDUSTRIELLE DE MATERIEL DE CONSERVATION SIMACO, crée en 1983, qui travaille dans le secteur Papier - fabrication. Elle est également présente dans les secteurs Papier pour l'industrie de l'emballage. Elle est basée à Bouzonville, France.",,"L'entreprise SOCIETE INDUSTRIELLE DE MATERIEL DE CONSERVATION SIMACO, crée en 1983, qui travaille dans le secteur Papier - fabrication. Elle est également présente dans les secteurs Papier pour l'industrie de l'emballage. Elle est basée à Bouzonville, France.",,,,,https://www.europages.fr/SOCIETE-INDUSTRIELLE-DE-MATERIEL-DE-CONSERVATION-SIMACO/FRA151580-00101.html
596,NERGECO,Fabricant/Producteur,"8, rue de l'Industrie",43220 Dunières,+33 683821564,"L'entreprise NERGECO, est un Fabricant/ Producteur, qui travaille dans le secteur Portes souples pour l'industrie. Elle est basée à Dunières, France.",https://www.nergeco.com/fr/portes-rapides-automatiques-nergeco-1.html,,,,https://www.europages.fr/NERGECO/00000005349128-644676001.html
597,CHAMBRE FRANCO ALLEMANDE DE COMMERCE ET D'INDUSTRIE,,,"L'entreprise CHAMBRE FRANCO ALLEMANDE DE COMMERCE ET D'INDUSTRIE, qui travaille dans le secteur Chambres de commerce et d'industrie. Elle est basée à Paris, France.",+33 140583585,"L'entreprise CHAMBRE FRANCO ALLEMANDE DE COMMERCE ET D'INDUSTRIE, qui travaille dans le secteur Chambres de commerce et d'industrie. Elle est basée à Paris, France.",http://www.francoallemand.com,,,,https://www.europages.fr/CHAMBRE-FRANCO-ALLEMANDE-DE-COMMERCE-ET-DINDUSTRIE/FRA804850-00101.html
598,LAUGERE INDUSTRIE SARL,Fabricant/Producteur,Lieu Dit Laugere,18210 Charenton Du Cher,,"L'entreprise LAUGERE INDUSTRIE SARL, est un Fabricant/ Producteur, crée en 1984, qui travaille dans le secteur Magasins - agencement. Elle est basée à Charenton Du Cher, France.",,,,,https://www.europages.fr/LAUGERE-INDUSTRIE-SARL/FRA042847-00101.html
599,AXOPTIQUE,Fabricant/Producteur,10 Rue Saint Gervais Le Vaumion,95710 Ambleville,,"L'entreprise AXOPTIQUE, est un Fabricant/ Producteur, crée en 2000, qui travaille dans le secteur Verre pour l'industrie. Elle est basée à Ambleville, France.",,,,,https://www.europages.fr/AXOPTIQUE/FRA356750-00101.html
600,SO INDUSTRIE,Fabricant/Producteur,1 Rue De Liege,92140 Clamart,,"L'entreprise SO INDUSTRIE, est un Fabricant/ Producteur, crée en 1985, qui travaille dans le secteur Mécanique générale - travail à façon. Elle est basée à Clamart, France.",,,,,https://www.europages.fr/SO-INDUSTRIE/FRA331787-00101.html
601,SOCOMEC INDUSTRIE,Fabricant/Producteur,Zone Industrielle,"L'entreprise SOCOMEC INDUSTRIE, crée en 1998, qui travaille dans le secteur Mécanique générale - travail à façon. Elle est basée à Faulquemont, France.",,"L'entreprise SOCOMEC INDUSTRIE, crée en 1998, qui travaille dans le secteur Mécanique générale - travail à façon. Elle est basée à Faulquemont, France.",,,,,https://www.europages.fr/SOCOMEC-INDUSTRIE/FRA030983-00101.html
602,SEROP INDUSTRIE,Fabricant/Producteur,Zi Des Hautes Garennes,"L'entreprise SEROP INDUSTRIE, crée en 1992, qui travaille dans le secteur Mécanique générale - travail à façon. Elle est basée à Chanteloup Les Vignes, France.",,"L'entreprise SEROP INDUSTRIE, crée en 1992, qui travaille dans le secteur Mécanique générale - travail à façon. Elle est basée à Chanteloup Les Vignes, France.",,,,,https://www.europages.fr/SEROP-INDUSTRIE/FRA096502-00101.html
603,ROLLS IDF,Grossiste,193 bis rue Danielle Casanova,93300 Aubervilliers,,"L'entreprise ROLLS IDF, est un Grossiste, qui travaille dans le secteur Papier pour l'industrie de l'emballage. Elle est basée à Aubervilliers, France.",,,,,https://www.europages.fr/ROLLS-IDF/00000005460377-827802001.html
604,BATEO,Fabricant/Producteur,10-12 rue Maurice Paillard ,93430 Villetaneuse,,"L'entreprise BATEO, est un Fabricant/ Producteur, qui travaille dans le secteur Céramique - machines pour l'industrie. Elle est basée à Villetaneuse, France.",,,,,https://www.europages.fr/BATEO/00000005495713-001.html
605,VER'ART,Fabricant/Producteur,,"L'entreprise VER'ART, qui travaille dans le secteur Verre pour l'industrie. Elle est également présente dans les secteurs Verre pour l'industrie des moyens de transport. Elle est basée à Onet Le Chateau, France.",,"L'entreprise VER'ART, qui travaille dans le secteur Verre pour l'industrie. Elle est également présente dans les secteurs Verre pour l'industrie des moyens de transport. Elle est basée à Onet Le Chateau, France.",,,,,https://www.europages.fr/VERART/FRA748419-00101.html
606,LOHR INDUSTRIE,Prestataire de services,,"Spécialiste mondial depuis plus de 45 ans dans la conception et la réalisation de systèmes de transports de biens et de personnes. LOHR Automotive commercialise les camions-remorques et véhicules industriels avec le camion porte-voitures (Eurolohr, Multilohr, Maxilohr). Les départements Transport public avec le tramway sur pneus Translohr, et Transport ferroviaire combiné rail-route / ferroutage avec le wagon surbaissé articulé Modalohr dépendent de LOHR Industrie.",+33 388389800,"Spécialiste mondial depuis plus de 45 ans dans la conception et la réalisation de systèmes de transports de biens et de personnes. LOHR Automotive commercialise les camions-remorques et véhicules industriels avec le camion porte-voitures (Eurolohr, Multilohr, Maxilohr). Les départements Transport public avec le tramway sur pneus Translohr, et Transport ferroviaire combiné rail-route / ferroutage avec le wagon surbaissé articulé Modalohr dépendent de LOHR Industrie.",http://www.lohr.fr/,,,,https://www.europages.fr/LOHR-INDUSTRIE/LFR000233-000018222001.html
608,CRISTALLERIES SCHWEITZER,Fabricant/Producteur,,"L'entreprise CRISTALLERIES SCHWEITZER, qui travaille dans le secteur Verre pour l'industrie. Elle est basée à Paris, France.",+33 142396163,"L'entreprise CRISTALLERIES SCHWEITZER, qui travaille dans le secteur Verre pour l'industrie. Elle est basée à Paris, France.",https://www.cristalleries-schweitzer-paris.com/,,,,https://www.europages.fr/CRISTALLERIES-SCHWEITZER/FRA767210-00101.html
609,MIROITERIE D'ART PROVENCALE,Fabricant/Producteur,,"L'entreprise MIROITERIE D'ART PROVENCALE, qui travaille dans le secteur Verre pour l'industrie. Elle est également présente dans les secteurs Verre pour l'industrie des moyens de transport. Elle est basée à Salon De Provence, France.",+33 490538814,"L'entreprise MIROITERIE D'ART PROVENCALE, qui travaille dans le secteur Verre pour l'industrie. Elle est également présente dans les secteurs Verre pour l'industrie des moyens de transport. Elle est basée à Salon De Provence, France.",https://www.miroiteriedartprovencale.com/,,,,https://www.europages.fr/MIROITERIE-DART-PROVENCALE/FRA779177-00101.html
610,BATAILLER LABO,Fabricant/Producteur,,"L'entreprise BATAILLER LABO, qui travaille dans le secteur Verre pour l'industrie. Elle est basée à Treillieres, France.",+33 251123847,"L'entreprise BATAILLER LABO, qui travaille dans le secteur Verre pour l'industrie. Elle est basée à Treillieres, France.",http://www.batailler-labo.fr,,,,https://www.europages.fr/BATAILLER-LABO/FRA600450-00101.html
611,L ART DU VERRE,Fabricant/Producteur,,"L'entreprise L ART DU VERRE, qui travaille dans le secteur Verre pour l'industrie. Elle est également présente dans les secteurs Verre pour l'industrie des moyens de transport. Elle est basée à Paris, France.",+33 142093339,"L'entreprise L ART DU VERRE, qui travaille dans le secteur Verre pour l'industrie. Elle est également présente dans les secteurs Verre pour l'industrie des moyens de transport. Elle est basée à Paris, France.",https://www.augreduverre.com/#Galerie,,,,https://www.europages.fr/L-ART-DU-VERRE/FRA598314-00101.html
612,COMPAGNIE D'OPERATIONS PETROLIERES SCHLUMBERGER,Prestataire de services,1 Cours Du Triangle,92800 Puteaux,+33 171122000,"Schlumberger est le premier fournisseur mondial de technologies, de servicesde gestion intégrée de projets et de solutions d’information pour lesclients de l’industrie pétrolière et gazière internationale.Fort de près de 123 000 collaborateurs de plus de 140 nationalités, dans près de 80 pays, Schlumberger fournit la plus large gamme de produits et de services (Oilfield Services  ) que peut offrir l’industrie au marché de l’exploration-production.Schlumberger est organisé en GeoMarkets, qui mobilisent des équipesà l’échelle de chaque marché géographique pour répondre aux besoinslocaux spécifiques et offrir des solutions sur mesure.",http://www.slb.com,,,,https://www.europages.fr/COMPAGNIE-DOPERATIONS-PETROLIERES-SCHLUMBERGER/FRA591470-00101.html
613,AUTOFORM,Fabricant/Producteur,Immeuble le meva,"AutoForm est une entreprise spécialisée dans la conception de solutions logicielles dédiées à l’industrie de l’outillage de presse et du formage de tôle.Les solutions AutoForm forment un système intégré complet doté de fonctions très spécialisées pour analyser, étudier et optimiser chaque phase de la chaîne de process.En terme de qualité, de délais et de coûts l’entreprise et reconnue mondialement dans plus de 40 pays, principalement dans les secteurs de l’automobile et des secteurs d’outilleurs, emboutisseurs et fournisseur de matériaux à travers le monde.",+33 442904260,"AutoForm est une entreprise spécialisée dans la conception de solutions logicielles dédiées à l’industrie de l’outillage de presse et du formage de tôle.Les solutions AutoForm forment un système intégré complet doté de fonctions très spécialisées pour analyser, étudier et optimiser chaque phase de la chaîne de process.En terme de qualité, de délais et de coûts l’entreprise et reconnue mondialement dans plus de 40 pays, principalement dans les secteurs de l’automobile et des secteurs d’outilleurs, emboutisseurs et fournisseur de matériaux à travers le monde.",http://www.autoform.com,,,,https://www.europages.fr/AUTOFORM/00000004455706-001.html
614,OCV CHAMBERY FRANCE,Fabricant/Producteur,130 Avenue Des Follaz,73000 Chambery,+33 479968200,"L'entreprise OCV CHAMBERY FRANCE, est un Fabricant/ Producteur, crée en 1979, qui travaille dans le secteur Isolation thermique - matériaux. Elle est également présente dans les secteurs Verre pour l'industrie, et Fibres et laine de verre. Elle est basée à Chambery, France.",http://www.vetrotexeurope.com,,,,https://www.europages.fr/OCV-CHAMBERY-FRANCE/FRA326406-00101.html
615,JEAN-PIERRE LE BIHAN VITRAUX,Fabricant/Producteur,,"L'entreprise JEAN-PIERRE LE BIHAN VITRAUX, qui travaille dans le secteur Verre pour l'industrie. Elle est basée à Quimper, France.",+33 298552038,"L'entreprise JEAN-PIERRE LE BIHAN VITRAUX, qui travaille dans le secteur Verre pour l'industrie. Elle est basée à Quimper, France.",http://lebihanvitraux.over-blog.fr/,,,,https://www.europages.fr/JEANPIERRE-LE-BIHAN-VITRAUX/FRA699565-00101.html
